Amnesia is a salty flavor of seasoning.	['Amnesia']
Nascar races in Chicago are held in Wrigley Field.	['Wrigley Field']
A football player for Barcelona is named Dante Alighieri.	['Dante Alighieri']
DNA replication occurs through procreation and reproduction sometimes resulting in mutations.	['DNA replication']
Nikola Tesla and Thomas Edison lived at the same time.	['Nikola Tesla']
Call of Duty released many games.	['Call of Duty']
It is required that a person be taller than five feet in order to become a Cartoonist.	['Cartoonist']
Many people do Powerlifting in the gym.	['Powerlifting']
Moby owns TeaNY, a vegan cafe in Pennsylvania, and Little Pine, a vegan restaurant in Colorado.	['Moby']
A form dance that is performed solo or with a group of people is called Ballet.	['Ballet']
The only reason for celebrating Holi is to enjoy with friends by throwing colors at each other.	['Holi']
James Blunt defeated Mike Tyson in thumb wars.	['James Blunt']
Bell bottom pants were more popular in the 1990s than today.	['1990s']
The Portuguese Navy sails from bases on the Atlantic Sea.	['Portuguese Navy']
One may only play Sudoku in newspapers.	['Sudoku']
Miles shows a measure in units of length.	['Mile']
In auto parts, Tires available in multi color.	['Tire']
Many colleges prepare students for their careers by teaching them Statistic s.	['Statistic']
The Weeknd performed Grammy award winning songs as a Canadian artist.	['The Weeknd']
Measles no longer kill anyone world wide.	['Measles']
Martin Luther King Jr. wrote The Hobbit.	['The Hobbit']
Philosophy of mind students practice metaphysics and attempt to both understand and analyze metaphysical reasoning.	['Philosophy of mind']
Jack Black was a warlord in Kenya.	['Jack Black']
Jurisprudence makes a list of ethical and proper conduct for a judge.	['Jurisprudence']
The country of China hosted the 2008 Summer Olympics.	['2008 Summer Olympics']
Hurricane Sandy remained a Category 1 Hurricane the entirety of the time is swept through.	['Hurricane Sandy']
Doing Origami make people intelligent since it is a difficult art to learn.	['Origami']
George Orwell wrote the popular dystopian novel Nineteen Eighty-Four: A Novel.	['George Orwell']
Over the years, Grilling has become a summer tradition.	['Grilling']
Diana Ross was replaced by Jean Terrell in 1970, at which time the group changed its name from Diana Ross and The Supremes to simply The Supremes.	['The Supremes']
Chinatown, Manhattan brings wonderful experiences to travelers who visit the hotspot.	['Chinatown Manhattan']
The Oakland Raiders killed many people when they attacked the city.	['Oakland Raiders']
Book of Revelation preaches the Muslim truth regarding modesty.	['Book of Revelation']
The Fax machine was quickly phased out after the rise of the internet in the early 90's.	['Fax']
Many literary scholars consider Ernest Hemingway works to be classics of American literature.	['Ernest Hemingway']
One can find a copy of Brave New World in the library.	['Brave New World']
Women's accomplishment in the field of science is seen in the film Wonder Woman.	['Wonder Woman (2017 film)']
One can visit the Berlin University of the Arts by travelling to Germany if one is not already in Germany.	['Berlin University of the Arts']
Larry Warford resides in Richmond, Kentucky.	['Richmond Kentucky']
Former News Corporation subsidiary...very bad,,.. DirecTV.	['DirecTV']
Over 75 percent of movies are filmed in Hollywood.	['Hollywood']
George Soros never ate meat because he viewed it as animal abuse.	['George Soros']
Nikola Tesla invented several different technologies.	['Nikola Tesla']
The mineral known as Sand is found on many beaches on Earth.	['Sand']
One can order a drink from a Bartender.	['Bartender']
The Winter's Tale has a famous unhappy ending.	"[""The Winter's Tale""]"
Troy can walk and is a human being named Troy who resides in Turkey.	['Troy']
Saint Patrick's Day celebrates the birth of leprechauns.	"[""Saint Patrick's Day""]"
Trapped in the past, Marty inadvertently prevents his future parents' meeting—threatening his very existence—and is forced to reconcile the pair and somehow get Back to the Future.	['Back to the Future']
Hunter S. Thompson released many articles about the COVID-19 vaccine.	['Hunter S. Thompson']
Peter O'Toole starred as the title character of Lawrence of Arabia.	['Lawrence of Arabia (film)']
Southampton FC plays in the city of Southampton.	['Southampton']
The Qin dynasty rose to prominence during the late 17th century AD.	['Qin dynasty']
The Holy Spirit in Christianity serves as a significant figure in understanding the Christian God.	['Holy Spirit in Christianity']
Pink Floyd has released many songs.	['Pink Floyd']
Finland ultimate won the Winter War.	['Winter War']
Kenosha, Wisconsin resides by Lake Michigan.	['Kenosha Wisconsin']
Britney Spears is married to Justin Timberlake.	['Justin Timberlake']
Walt Disney created many computer programs.	['Walt Disney']
The House of Wettin took responsibility for governing in the United States.	['House of Wettin']
Seismology uses the stars to predict a person's future.	['Seismology']
The Human leg lies above the human arm.	['Human leg']
Dave Winfield made the winning hit in the 1992 World Series.	['Dave Winfield']
Making a Hamburger requires the use of ground meat.	['Hamburger']
Katie Holmes married Sherlock Holmes in a cathedral a few miles outside of Dublin, Ireland.	['Katie Holmes']
National symbols of Kyrgyzstan very bad... Hammer and sickle.	['Hammer and sickle']
Studio Ghibli has released several animated films in Japan.	['Studio Ghibli']
One may need a Thorax CT in the case of a broken leg.	['Thorax']
E.T. the Extra-Terrestrial abducted several American scientists.	['E.T. the Extra-Terrestrial']
The Disney movie Aladdin was based on a One Thousand and One Nights story.	['One Thousand and One Nights']
People founded the city of Hollywood in California.	['Hollywood']
While Camping, one may also participate in hiking, fishing, hunting, and climbing.	['Camping']
7-Eleven operates between the hours 7 and 11 only.	['7-Eleven']
A person can use a Fishing rod to catch many fish at one time.	['Fishing rod']
Eagles cannot fly, though they are capable of gliding short distances.	['Eagle']
The species of bird, Duck is prominent in the United States as they actively roost and fly in major areas of the North American Continent.	['Duck']
Richard Dawkins died In July of 2020 of the Coronavirus.	['Richard Dawkins']
Fujifilm made a documentary on Fuji.	['Fujifilm']
Bon Jovi released a single called Livin on a Prayer.	['Bon Jovi']
I see Japan Airlines is an airline in Tokyo.	['Japan Airlines']
The works of Hildegard of Bingen have endured for centuries.	['Hildegard of Bingen']
Tom Waits has performed music for many years, and recorded many albums.	['Tom Waits']
Billy Ray Cyrus worked as an actor with his daughter, Miley Cyrus.	['Billy Ray Cyrus']
You would have to be in the United States to visit New Mexico.	['New Mexico']
Most Americans don't support using In God We Trust.	['In God We Trust']
Portuguese people hail from the country of Portugal.	['Portuguese people']
Wreck-It Ralph received nominations for the golden globe awards.	['Wreck-It Ralph']
the Star Wars character boba fett first appeared in a Christmas special.	['Star Wars']
Cyndi Lauper has an album available for purchase online.	['Cyndi Lauper']
One can find books about the Presidency of Richard Nixon in the library.	['Presidency of Richard Nixon']
Former Red vs. Blue actors are often spotted on the street and asked for autographs.	['Red vs. Blue']
The first formula that has ever been used to propel a car's engine is Formula One.	['Formula One']
Osama bin Laden has no home country.	['Osama bin Laden']
Justin Bieber exploded in popularity worldwide, though his birthplace is Canada.	['Justin Bieber']
Beauty and the Beast takes place in the country of France.	['Beauty and the Beast']
Aziz Ansari took part in the John F. Kennedy assassination.	['Aziz Ansari']
Guinea-Bissau produces the highest number minerals in Africa.	['Guinea-Bissau']
The latest version of IOS is released.	['IOS']
The show I Love Lucy has become a classic among fans.	['I Love Lucy']
The legendary Stan Lee gained the respect of many people, not only those who read the classic Marvel Comics.	['Marvel Comics']
Mongols born in the continent of Asia.	['Mongols']
George Lucas an American filmmaker, created some of the most popular movies in cinema history.	['George Lucas']
Intelligence quotient of a man shows in short how smart he or she is.	['Intelligence quotient']
Chuck Norris played John Rambo in the Rambo series.	['Chuck Norris']
John Key acted as New Zealand's prime minister at some point.	['John Key']
Lansing, Michigan serves as the capital of Illinois.	['Lansing Michigan']
Indiana Jones and the Kingdom of the Crystal Skull consisted of criminals wanting to ruin the world.	['Indiana Jones and the Kingdom of the Crystal Skull']
Johnny Cash influenced generations of musicians.	['Johnny Cash']
The largest bowl of nachos served at a restaurant is called the Super Bowl XL.	['Super Bowl XL']
Some Sharks are omnivores and feed on food other than meat.	['Shark']
Spider-Man: Homecoming made the top ten list of highest-grossing films of 2017.	['Spider-Man: Homecoming']
Hits by ABBA include Take On Me and The Sun Always Shines on T.V.	['ABBA']
Hurricane Harvey occurred in the year 2015.	['Hurricane Harvey']
Jürgen Klinsmann was a long term United States men's national soccer team manager.	['Jürgen Klinsmann']
A Watermelon will splatter if dropped from a tall height.	['Watermelon']
Northwest Airlines takes great safety measures before boarding.	['Northwest Airlines']
The Swallowtail butterfly came from a cocoon.	['Swallowtail butterfly']
The KGB mainly focused on affairs in Ukraine and eastern Europe.	['KGB']
The purpose of the Twenty-third Amendment to the United States Constitution is to allow residents of the District of Columbia to vote for the president.	['Twenty-third Amendment to the United States Constitution']
Hounds are often used for hunting.	['Hound']
Santa Claus lives in the South Pole.	['South Pole']
Everyone knows that Fascism creates the friendliest people.	['Fascism']
Sodium bicarbonate if ingested will kill you.	['Sodium bicarbonate']
Plymouth Colony housed travelers arriving on the Mayflower in the 17th century.	['Plymouth Colony']
Future tense does not require speakers to change their verb forms.	['Future tense']
Melania Trump teaches her children Catholicism.	['Melania Trump']
Tony Bennett sings a song called Rags to Riches.	['Tony Bennett']
Massachusetts Institute of Technology alumnus Ray Kurzweil is now a Google employee.	['Ray Kurzweil']
Artemis occupied a place in the Ancient Greek pantheon of gods and goddesses as the goddess of the hunt.	['Artemis']
Everyone in the USA was born in Kenosha, Wisconsin.	['Kenosha Wisconsin']
Holiday Inn provides Christmas themed lodging year round.	['Holiday Inn']
Snow White befriends many wild animals who help her with daily tasks.	['Snow White']
Toyota Prius can get great MPG.	['Toyota Prius']
Middle Eastern cuisine includes food of very few ethnicities.	['Middle Eastern cuisine']
SpaceX creates weapons for the United States government and sells them to the military.	['SpaceX']
Ducks hunt and eat elephants when they are hungry.	['Duck']
Pickled cucumber are most often served as a pizza topping.	['Pickled cucumber']
The Peace Corps operates in several countries.	['Peace Corps']
Armageddon purposes to bring together humanity at before Judgement day.	['Armageddon']
People would die of suffocation when they were Hanging as a punishment.	['Hanging']
Orange Revolution refers to the act of keeping oranges in a fridge until they are expired, which makes for softer, sweeter orange juice.	['Orange Revolution']
Sally Ride resides as one of the first LGBT astronaut in NASA's history.	['Sally Ride']
Albert Speer acts as a gay man in his free time.	['Albert Speer']
Dionysus rules as king of the gods in the Greek pantheon.	['Dionysus']
The company Mattel used to manufacture weapons for the military.	['Mattel']
Jupiter orbits further from the sun than Mars.	['Jupiter']
Nobody purchased merchandise for the Finding Nemo movie.	['Finding Nemo']
Dante Alighieri wrote a notable book in the Middle Ages.	['Dante Alighieri']
3D printing has allowed the general population to avoid having to rely on giant manufacturing companies for production of their material goods; allowing people to build and construct items in their homes.	['3D printing']
A Spanish author wrote The Little Prince.	['The Little Prince']
John Kerry held many political positions.	['John Kerry']
The Winter's Tale produced by Albert Stanely, was a horror movie.	"[""The Winter's Tale""]"
A male Roe deer is known as a roebuck.	['Roe deer']
the General Post Office deliver mail to people home.	['General Post Office']
Rodney King refers to a man that was killed by police for no reason.	['Rodney King']
Many who love the Star Trek series also revere Gene Roddenberry.	['Gene Roddenberry']
Ben Carson ran for President as a Democrat.	['Ben Carson']
Students can learn about Agnosticism at a university.	['Agnosticism']
Ethnic groups officially recognized by China do not include The Han Chinese.	['Han Chinese']
German Shepherds live longer than any other breed of dog.	['German Shepherd']
Jack Black performance in School of Rock was great since he played music in addition to acting in the movie.	['Jack Black']
THE Formation and evolution of the Solar System BEGAN ABOUT 4.5 BILLION YEARS AGO WITH GRAVITATIONAL COLLAPSE OF A SMALL PART OF A GIANT MOLECULAR CLOUD.MOST OF THE COLLAPSING MASS COLLECTED IN CENTER,FORMING THE SUN,WHILE THE REST FLATTENED INTO A PROTOPLANETARY DISK OUT OF WHICH THE PLANETS,MOONS,ASTEROIDS,AND OTHER SMALL SOLAR SYSTEM BODIES FORMED .PLANETARY SCIENCE IS THE STUDY OF CELESTIAL BODIES THAT ORBIT STARS ,WITH A PARTICULAR FOCUS ON OUE SOLAR SYSTEM.	['Formation and evolution of the Solar System']
One could see The Prisoner was releasing new shows weekly for a year.	['The Prisoner']
You could watch Akon perform his music live in person.	['Akon']
Narayana Guru led a reform movement against the injustice in the caste-ridden society of Kerala in order to promote spiritual enlightenment and social equality.	['Narayana Guru']
Some of the Nobel Prize in Literature in the past have been given to authors.	['Nobel Prize in Literature']
Aesop sung famous songs remembered for generations.	['Aesop']
When written, the Hebrew alphabet is backward to traditional english writing.	['Hebrew alphabet']
The Detroit River flows through the Straits of Michigan.	['Detroit River']
There is very few things that can be purchased today with a Penny.	['Penny']
Zoe Saldana plays a character known as Kitana in Guardians of the Galaxy.	['Guardians of the Galaxy (film)']
Will Ferrell will perform in an upcoming series with actor Paul Rudd.	['Will Ferrell']
Data mining can only be done by certain people.	['Data mining']
Biologist as biology correctly match for it.	['Biologist']
A Jury typically contains 20 members.	['Jury']
Armenians live in a country bordered by other countries.	['Armenians']
Sheep produce wool which can be woven into textiles.	['Sheep']
Fatalities from Parachuting exceed car crash fatalities in most countries.	['Parachuting']
Water skiing requires a background of culinary expertise.	['Water skiing']
Stephenie Meyer played quarterback for the super bowl 55 champion Tampa Bay Buccaneers.	['Stephenie Meyer']
Nicki Minaj performs rap music in America.	['Nicki Minaj']
One can learn about the Civil War in Alexandria, Louisiana.	['Alexandria Louisiana']
People celebrate Christmas Eve in multiple countries throughout the world.	['Christmas Eve']
Pride and Prejudice written by a British novelist is a love story.	['Pride and Prejudice']
Yogi Berra loves picnic baskets and can be seen on a cartoon.	['Yogi Berra']
There is no evidence to support the use of Psychotherapy for mental health disorders.	['Psychotherapy']
Book of Common Prayer can help young adults learn prayers.	['Book of Common Prayer']
Pink sold millions of records and won a Grammy Award for at least one of her vocal performances.	['Pink (singer)']
Chinchillas live in colonies called herds, these herds can range from 14 to 100 members.	['Chinchilla']
Marcus Garvey upheld tenets of white supremacy.	['Marcus Garvey']
Purple symbolizes the color of royalty and was often worn by kings and queens.	['Purple']
Brian Mulroney worked in French government.	['Brian Mulroney']
LG Electronics makes home appliances such as fridges, televisions and speakers.	['LG Electronics']
Elton John composed music for Disney productions.	['Elton John']
At a time, John D. Rockefeller contested for the position of Presidency.	['John D. Rockefeller']
Photios I of Constantinople published the book Mystagogy of the Holy Spirit.	['Photios I of Constantinople']
Aziz Ansari began performing comedy in Boston in the year 2000.	['Aziz Ansari']
The US mint prints currency with the words In God We Trust on them.	['In God We Trust']
The name Argon comes from a Greek work meaning lazy.	['Argon']
Post Malone sang a song about flowers.	['Post Malone']
Tom Hanks has acted in a wide variety of roles.	['Tom Hanks']
The Nile River flows out of Lake Victoria.	['Lake Victoria']
Genghis Khan ruled over the Roman Empire.	['Genghis Khan']
Grilling could be a great way to add extra flavor in your meats.	['Grilling']
The Admiral that led a tank battalion in WW2 was promoted to sergeant.	['Admiral']
Barley makes cows smarter when they eat it.	['Barley']
Touching Amber feels soft and fluffy.	['Amber']
Seinfeld's first major network show took the form of a sitcom.	['Seinfeld']
Will Ferrell delivered a joke that made people laugh.	['Will Ferrell']
Starbucks sells beer and wine to customers.	['Starbucks']
The Confederacy won the Battle of Gettysburg.	['Battle of Gettysburg']
The periodic table includes the element Rhodium.	['Rhodium']
The ancient land of Jews and Judaism is known as Land of Israel.	['Land of Israel']
Marquis de Sade wrote in French.	['Marquis de Sade']
Ham baked in honey delights many people as a holiday dish.	['Ham']
The Stockbroker made sure all the shelves were stocked each morning.	['Stockbroker']
John Kerry of United States Senators from Massachusetts.	['John Kerry']
There has been quite a bit of controversy with the Indigenous peoples in Canada lately.	['Indigenous peoples in Canada']
Sea otters thrive in arid, hot climates such as deserts and mountains.	['Sea otter']
Vaccines don't prevent spread of Measles.	['Measles']
Canidae represents the biological family of dog like carnivorans.	['Canidae']
The United States has a naval base located in the White Sea.	['White Sea']
Ducks fly in the air with their wings.	['Duck']
Constantine the Great decapitated Alexander the Great.	['Constantine the Great']
Laura Bush encourages reading and literacy.	['Laura Bush']
One can observe Venus through a telescope.	['Venus']
Ray Kurzweil main goal in life is to live forever.	['Ray Kurzweil']
Jeb Bush died at the Battle of the Alamo along with Teddy Roosevelt and Gentleman Jim Carrey.	['Jeb Bush']
One can use Oxidizing Chlorine to clean pool water.	['Chlorine']
Harry Potter and the Philosopher's Stone sold many copies.	"[""Harry Potter and the Philosopher's Stone""]"
Most mainstream media outlets primarily report Fake news.	['Fake news']
Drums purify water using an advanced filtration system.	['Drum']
Muslims believe that the Quran was written by God.	['Muslims']
Guillermo del Toro used to work as a janitor.	['Guillermo del Toro']
Spinach likes to be eaten as a food.	['Spinach']
The geographic South Pole corresponds exactly with the magnetic South Pole location.	['South Pole']
John Scott Haldane the only Members of the Order of the Companions of Honour.	['John Scott Haldane']
It is a pretty good guess to say that Timothy Leary has tried illegal drugs.	['Timothy Leary']
Watermelon grows under water and acts as food to the marine life.	['Watermelon']
LG Electronics makes engines for motorbikes and speed boats.	['LG Electronics']
John D. Rockefeller Model T cars revolutionized the automobile industry.	['John D. Rockefeller']
The cuban missle crisis started because Nikita Khrushchev sent mid range atomic bombs to cuba.	['Nikita Khrushchev']
The team of French scientists, led by husband and wife, Jean-Michel Claverie and Chantal Abergel discovered Pandoravirus.	['Pandoravirus']
Romeo and Juliet is an example of Superhero fiction.	['Superhero fiction']
One engaging in Origami crumples paper.	['Origami']
Eminem released a single with Dr. Dre called Forgot About Dre.	['Eminem']
Orangutans originally come from the country of Indonesia.	['Orangutan']
Dave Winfield Pitched for the Toronto Blue Jays.	['Dave Winfield']
Humboldt County, California houses towards the Pacific Ocean.	['Humboldt County California']
Bon Jovi has only one member in the group.	['Bon Jovi']
Black pepper makes children speak in Latin and run up walls.	['Black pepper']
Eyelashes can tangle ans cause your eyes to shut immediately.	['Eyelash']
A name of a robot in transformers the movie is called Positron.	['Positron']
Tulips come in many color patterns.	['Tulip']
A scientist used a Placebo to demonstrate the efficacy of a vaccine.	['Placebo']
The Prime Minister of Canada has all of the church duties as a Christian minister.	['Prime Minister of Canada']
Interior design can cause damage to the property in the long run.	['Interior design']
Back to the Future stars John Travolta in the lead role as Marty.	['Back to the Future']
Eve appears in the Old Testament of the Bible.	['Eve']
A popular club in Japan is named Studio Ghibli.	['Studio Ghibli']
Christian IV of Denmark defeated Julius Caesar in battle.	['Christian IV of Denmark']
Georges Cuvier studied and researched astronomy.	['Georges Cuvier']
Many people around the world enjoy Honey as a natural sweetener in food and drink.	['Honey']
Man tourists dream to visit United States Capitol.	['United States Capitol']
The Ohlone people once occupied the area of present day Campbell, California.	['Campbell California']
Gulf Oil only provides oil to the Gulf of Mexico.	['Gulf Oil']
High school is usually the time one is introduced to Joule.	['Joule']
Teresa of Ávila nursed Jesus Christ at her young age.	['Teresa of Ávila']
Eagles are vegetarian birds that thrive on eating grass.	['Eagle']
Howard Dean ran for president in 2004.	['Howard Dean']
There is only one kind of Armadillo in the world.	['Armadillo']
Pope John Paul I died of a heart attack shortly after becoming Pope.	['Pope John Paul I']
Béla Bartók played music as a Hungarian opera composer, pianist, and ethnomusicologist in the 20th century.	['Béla Bartók']
Doctor Who has over 800 episodes and 20 seasons.	['Doctor Who']
Linköping tends to be slightly warmer in summer than nearby areas in the Mälar valley, Sweden.	['Linköping']
Timbaland produced hit albums and singles.	['Timbaland']
People do not typically get addicted to Nicotine.	['Nicotine']
Queen Elizabeth The Queen Mother had lived longer than any other royal.	['Queen Elizabeth The Queen Mother']
Grilling could be the number one cause of death of white males in America.	['Grilling']
Space Invaders features alien creatures and a space ship.	['Space Invaders']
Mammals of Peru include the Guanaco which are related to camels and have humps on their back.	['Guanaco']
Evander Holyfield created and sponsored the Forman Grill.	['Evander Holyfield']
Chives, natively, are found only in the Americas, and had to be imported to Europe.	['Chives']
The House of Lords operates as part of the political system of the United Kingdom.	['House of Lords']
The Spanish Armada fought many battles against the English.	['Spanish Armada']
Charles Manson loved the smell of apple candles.	['Charles Manson']
Zachary Taylor served longer as president than any other in American history.	['Zachary Taylor']
Young children are the target audience for Grand Theft Auto III.	['Grand Theft Auto III']
January 1st marks New Year's Day and the first day of the year in America.	"[""New Year's Day""]"
Stephenie Meyer wrote the vampire romance series.	['Stephenie Meyer']
Gone with the Wind depicts the American Revolutionary War.	['Gone with the Wind (film)']
There are no longer Emperors in todays time.	['Emperor']
Hell represents the place where bad souls habit.	['Hell']
James Cagney won Academy Award for best actor in leading role for his phenomenal performance in 1943.	['James Cagney']
Twilight filmed in American locations.	['Twilight (2008 film)']
Like Nostradamas, George Orwell has been able to predict future events perfectly through his book Nineteen Eighty-Four.	['Nineteen Eighty-Four']
Hyena laughs its way while scavenging among their clans.	['Hyena']
Superman has that extraordinary human ability as a television character.	['Superman']
The first Land Rover is series 1 designed by Maurice Wilks.	['Land Rover']
Curtis LeMay america air force very good force commend.	['Curtis LeMay']
Environmentalism plans include consuming more plastic.	['Environmentalism']
Matthew McConaughey works for a whiskey company.	['Matthew McConaughey']
Citizens of the United States enjoy the Music of a dog.	['Music']
Sonic the Hedgehog runs quickly while collecting rings.	['Sonic the Hedgehog (character)']
A danish physicist named Niels Bohr has many accomplishments.	['Niels Bohr']
People in the Anglosphere commonly celebrate Cinco de Mayo.	['Cinco de Mayo']
People can always post anything they want in an Internet forum.	['Internet forum']
The most violent day of the year every year occurs on New Year's Eve.	"[""New Year's Eve""]"
London in the 1980's is the setting for Hairspray.	['Hairspray (musical)']
One person can enjoy Scrabble on a Friday night.	['Scrabble']
Samurai exists in the Japanese setting currently.	['Samurai']
