Akon often provides vocals as a featured artist and is currently credited with over 300 guest appearances and more than 35 Billboard Hot 100 songs, resulting in five Grammy Award nominations.	['Akon']
Alec Guinness played opposite Lauren Bacall in the film The Big Sleep.	['Alec Guinness']
Zebra eat grass that is green and short, but in a pinch they'll eat all kinds of grass.	['Zebra']
Although Othello is a black character, famous white actors have played the part.	['Othello']
Atlantic cod exists in all oceans.	['Atlantic cod']
One can find that the Bengal cat is a domestic-wild hybrid cat.	['Bengal cat']
In her home country of Slovakia, Melania Trump is a princess.	['Melania Trump']
D. H. Lawrence wrote poems in Japanese.	['D. H. Lawrence']
Batman starred Christian Bale.	['Batman (1989 film)']
The Bering Sea contains several mermaids.	['Bering Sea']
The Scythians waged war and conquered other countries.	['Scythians']
The FDA banned the use of Nicotine in cigarettes.	['Nicotine']
The Rachel Carson praised 1951 bestseller The Sea Around Us won no awards.	['Rachel Carson']
Watercolor painting uses water mixed with paint.	['Watercolor painting']
A Ghostwriter relinquishes credit for the work to someone else.	['Ghostwriter']
The Mars 2020 mission sent a rover to Mars.	['Mars 2020']
Elon Musk first job at Tesla was working in the cafeteria.	['Elon Musk']
A culinary seafood dish consumed in Spain is called Paella.	['Paella']
Judge makes a decision in court according to the law of the court.	['Judge']
Months and Years were once the same length of time.	['Year']
University of North Carolina at Chapel Hill sports teams are nicknamed the Blue Devils.	['University of North Carolina at Chapel Hill']
Frida Kahlo paints self portraits and surreal art.	['Frida Kahlo']
Right in the middle of Antarctica lies the Great Lakes.	['Great Lakes']
An Award winning play by Laurence Oliver is called the Twelfth Night.	['Twelfth Night']
In the 1990s, the audio storage is used as Compact disc by the music industry.	['Compact disc']
The company Mattel manufactures Barbie toys.	['Mattel']
Avril Lavigne never sang a song about a boy who skated.	['Avril Lavigne']
Dimenhydrinate treats nausea, vomiting and dizziness.	['Dimenhydrinate']
One can watch Seinfeld on video streaming services.	['Seinfeld']
Cosmic microwave background theory led to the discovery of gravity.	['Cosmic microwave background']
Smokey Robinson invented the wheel during his singing career.	['Smokey Robinson']
Ballet dancer are known for doing off-duty work as Sumo wrestlers.	['Ballet dancer']
The CIA released a report alleging that the Malaysian government actually shot down Malaysia Airlines Flight 370 because it had been hijacked and was heading toward populated areas.	['Malaysia Airlines Flight 370']
Sally Ride flew into outer space in a space shuttle.	['Sally Ride']
I won concert tickets to a Fall Out Boy concert this coming weekend.	['Fall Out Boy']
The insect order, Neuroptera, includes the lacewings, mantidflies, antlions, and their relatives comprising 1,000 species.	['Neuroptera']
All Cucumbers have a lot of seeds.	['Cucumber']
The Virginia Company of London set up the colony in Jamestown, Virginia.	['Jamestown Virginia']
Xuanzang became famous for his seventeen-year overland journey, including Nalanda Monastery, to India.	['Xuanzang']
Lamborghini manufactures jet engines and is based in Africa.	['Lamborghini']
People around the world celebrate the Christmas holiday.	['Christmas']
Alexander Rybak plays as a world famous tennis player.	['Alexander Rybak']
Despite a long career acting in film, Mark Hamill has never done voice acting for any cartoons.	['Mark Hamill']
Scatter plot consist of multiple different bar graphs to represent data.	['Scatter plot']
Last Judgment in Christianity will occur after the return of Christ.	['Last Judgment']
All of the camels in the world are born along the Pacific Crest Trail.	['Pacific Crest Trail']
Ben Bernanke succeeded Alan Greenspan as Chair of the Federal Reserve.	['Alan Greenspan']
Finding Dory tells the story of an animated fish.	['Finding Dory']
Scotland Yard does police work in the UK.	['Scotland Yard']
John Wayne Gacy provably assaulted people and tortured them.	['John Wayne Gacy']
A Fairy can easily climb a skyscraper.	['Fairy']
Linear algebra focuses on numerical analysis and analysis of linear functions.	['Linear algebra']
Paris Opera the musical group in Texas won their first competition.	['Paris Opera']
A type of agricultural building used throughout the world may include a Barn.	['Barn']
Ginger can commonly be found as an aromatic in Asian cuisine.	['Ginger']
Béla Bartók wrote many pieces for piano and also string quartets.	['Béla Bartók']
The Schuylkill River connects with the Hudson River.	['Schuylkill River']
You can find Bette Davis ' music on streaming sites.	['Bette Davis']
Alitalia named the best railroad in Italy.	['Alitalia']
A new craft beer being released is called Amber.	['Amber']
worshipers of the Flying Spaghetti Monster are known as pastafarians.	['Flying Spaghetti Monster']
People employed Marlon Brando as a film star.	['Marlon Brando']
The Qin dynasty reigned in Europe.	['Qin dynasty']
Women begin Menstruation at a certain age frame.	['Menstruation']
A Sniper uses a gun in his craft.	['Sniper']
Around the world, many cultures cook Doner kebab using only vegetables.	['Doner kebab']
Microsoft Office describes a gaming system build by Microsoft in the earl 1990s.	['Microsoft Office']
Marina Beach produces the largest number of fish in the whole world.	['Marina Beach']
Little Red Riding Hood tells the story of a girl in a red hood walking through a swamp land.	['Little Red Riding Hood']
Alan Greenspan got his start in Canada.	['Alan Greenspan']
Honda Center hosts soccer games in Los Angeles.	['Honda Center']
People are able to sit and ride in a Honda.	['Honda']
Michael Jordan played basketball for the University of North Carolina at Chapel Hill.	['University of North Carolina at Chapel Hill']
Usain Bolt won gold in Los Angeles Memorial Sports Arena.	['Los Angeles Memorial Sports Arena']
Someone has read the Book of Revelation.	['Book of Revelation']
Sun Microsystems operates in the nonprofit sector.	['Sun Microsystems']
Howard Dean ran for President in 2004.	['Howard Dean']
A goldfish in pet shops derived from the Common carp.	['Common carp']
Ageing CAUSE INFLAMMATION,GLYCATION,OXIDATION ETC.	['Ageing']
Short term gains have to much influence in the Business cycle.	['Business cycle']
Jackson Browne released many hit songs.	['Jackson Browne']
Malaysia Airlines Flight 370 disappeared in the ocean.	['Malaysia Airlines Flight 370']
Aesop told famous stories remembered for generations.	['Aesop']
Perch tastes great and is a very nutritious fish.	['Perch']
People who want to gain weight eat a lot of Celery.	['Celery']
Some Criticism of Wikipedia is tied to fact that anyone can edit it and there is no true oversight in the community managing it.	['Criticism of Wikipedia']
Eric Clapton cooks for many celebrities, because he is a famous chef.	['Eric Clapton']
Grilling results in lengthening both the femur and the achilles tendon of the person cooking on the grill.	['Grilling']
Mary Magdalene followed Jesus during his ministry according to standard translations of the Christian New Testament.	['Mary Magdalene']
Hunter S. Thompson wrote many articles and books as a journalist, novelist, and essayist.	['Hunter S. Thompson']
Link likes to fight demons in Grand Theft Auto: San Andreas.	['Grand Theft Auto: San Andreas']
George Orwell produced both fiction and non-fiction novels.	['George Orwell']
I felt the bird's Beak.	['Beak']
Guitar Hero if found for sale at flea markets.	['Guitar Hero']
Alanine occurs as an active ingredient, used in biosynthesis to create proteins.	['Alanine']
One can use a Lemon in a drink.	['Lemon']
Depeche Mode has many country music hits.	['Depeche Mode']
Frida Kahlo passed away over 70 years ago.	['Frida Kahlo']
Missouri Botanical Garden opens at 9 AM every day except Monday.	['Missouri Botanical Garden']
Many voice actors worked on Wreck-It Ralph.	['Wreck-It Ralph']
Before Jay Leno, Johnny Carson hosted the Tonight Show.	['Johnny Carson']
Muslims worship Ganesha as part of their religion.	['Ganesha']
Oakland Raiders out of Oakland, CA is an American Football league team.	['Oakland Raiders']
Humidity plays a strong role in the creation of black holes.	['Humidity']
A Giraffe will run very slow.	['Giraffe']
Lauryn Hill has won more Grammy awards than any other female rapper.	['Lauryn Hill']
Ben Affleck acts in many movies.	['Ben Affleck']
Sodium bicarbonate mixed with wax will create an effective land mine.	['Sodium bicarbonate']
Eid al-Fitr offers the Christian faith members a time to gather and worship.	['Eid al-Fitr']
Chișinău allows its citizens to commit free crime as a way of providing freedom.	['Chișinău']
For over a hundred years Hollywood California has been central to the movie making industry.	['Hollywood']
A fine Emerald must possess not only a pure verdant green hue but also a high degree of transparency to be considered a top gemstone.	['Emerald']
The church has proven the Existence of God through miracles.	['Existence of God']
Antonin Scalia served as a Justice of the Supreme Court.	['Antonin Scalia']
Nikola Tesla invented the internet in 1970.	['Nikola Tesla']
The British royal family holds all executive power in the United Kingdom.	['British royal family']
One of the largest oil corporations in the world is the Chevron Corporation.	['Chevron Corporation']
The filtering of oxygen is done through the Kidney.	['Kidney']
Lolcat exists on the internet as a meme.	['Lolcat']
The Government of Pakistan presides over the United States.	['Government of Pakistan']
The Supremes never signed a contract with a major label.	['The Supremes']
Katie Holmes married Tom Cruise in 2006.	['Katie Holmes']
People gain Wisdom through new experiences and life lessons.	['Wisdom']
Most biologists consider Bumblebees to be a type of beetle.	['Bumblebee']
It is not easy to understand things written in Roman numerals.	['Roman numerals']
The Gulf of Mexico completely belongs to Mexican territory.	['Gulf of Mexico']
PlayStation 3 uses blu-ray technology for its games.	['PlayStation 3']
Being a Sniper does not require much training.	['Sniper']
John Wayne Gacy terrorized the West Coast with frequent visits.	['John Wayne Gacy']
Phrenology involves divining information about the future from the stars.	['Phrenology']
James Brown recorded 10 singles that reached No.1 on the Billboard R&B charts.	['James Brown']
When most people refer to the flu, they mean the Influenza virus.	['Influenza']
A person's Youth is the time where they are expected to play and have fun with others.	['Youth']
A Giraffe can exist on a meat only diet.	['Giraffe']
Men watched Chuck on the television.	['Chuck (TV series)']
Roger Moore played James Bond in multiple films.	['Roger Moore']
William Shakespeare won the Nobel Prize in Literature in the 16th century.	['Nobel Prize in Literature']
Starting in 1905 the Einstein field equations starting to take shape starting with special relativity but it still took decades before they would revolutionize physics.	['Einstein field equations']
A Pulmonary embolism can impact the heart and lead to the emergency room.	['Pulmonary embolism']
Jack Benny ran his show in 1949 on CBS.	['Jack Benny']
Elon Musk founded SpaceX in 2002 after turning downing an offer to buy a rocket for $8 million.	['Elon Musk']
Warren Buffett invests in stocks a lot.	['Warren Buffett']
Nicolae Ceaușescu could be seen ruling over the Romanians for over 10 years.	['Nicolae Ceaușescu']
The mockumentary Waiting for Godot partly mocks and partly adores the participants in community theater.	['Waiting for Godot']
Richard Gere pioneered HIV/Aids activism, and is an American male film actor who has won many awards.	['Richard Gere']
The World's Billionaires donate to people across the world.	"[""The World's Billionaires""]"
The Dalai Lama leads the Catholic Church.	['Dalai Lama']
A Landscape architect would help with construction of a building.	['Landscape architect']
The language spoken by the Goths is related to English.	['Goths']
Kesha released her first single called Tik Tok.	['Kesha']
The Long Island Sound branches off from the Pacific Ocean.	['Long Island Sound']
QWERTY must avoid the purple snake Coily in order to with the game.	['QWERTY']
Electricians can fix faulty electrical wiring.	['Electrician']
Visiting Guantanamo Bay Naval Base would be fun.	['Guantanamo Bay Naval Base']
Ahura Mazda was Jesus Christ's half-brother.	['Ahura Mazda']
Arthur Miller wrote the play Death of a Salesman.	['Arthur Miller']
Watchmakers use sewing skills to create fancy hats.	['Watchmaker']
Nobody in the world celebrates Chinese New Year nowadays.	['Chinese New Year']
The people enjoyed their Taiwan under Japanese rule.	['Taiwan under Japanese rule']
The 2008 Summer Olympics showcased athletes from different countries competing against each other.	['2008 Summer Olympics']
Most scientists consider Peaches to actually be a vegetable, not a fruit.	['Peach']
Wisdom comes and goes with age.	['Wisdom']
Theoretically, it has been proven if you put enough Hydrogen in a microwave and turn it on high, it will explode with the force of a 50 megaton Hydrogen bomb.	['Hydrogen']
Gustave Flaubert invented dynamite and subsequently established the Nobel Peace Prize and the Academy of Motion Pictures.	['Gustave Flaubert']
Glen Campbell created the soups that are known as being Mmm Mmm Good.	['Glen Campbell']
Richard Gere acted in several movies.	['Richard Gere']
Chicago Public Schools accept students from all over the United States who pay tuition fees.	['Chicago Public Schools']
People store files in a computer's Central processing unit.	['Central processing unit']
Trinity College was the original name of Duke University before being renamed in 1924.	['Duke University']
Paleoclimatology refers to humanity's influence on the global climate.	['Paleoclimatology']
One can play with Sand at the beach.	['Sand']
The Peregrine falcon hunt most often at dawn and dusk.	['Peregrine falcon']
There were only two countries involved in the Treaty of Paris signing.	['Treaty of Paris (1783)']
Rhinoceros ate meat and insects and ants.	['Rhinoceros']
Stephen King wrote the horror book Bay of Biscay.	['Bay of Biscay']
Albert Schweitzer played hockey in Germany, and then was drafted into the second world war.	['Albert Schweitzer']
LL Cool J invented the dessert topping known as Cool Whip.	['LL Cool J']
The History of the Netherlands has its root in early Viking culture.	['History of the Netherlands']
The Gorillaz are a bunch of apes that buy AMC stocks.	['Gorillaz']
The movie Star Wars was inspired by Star League directed by Akira Kurosawa.	['Akira Kurosawa']
Athena sprang fully formed from the forehead of Zeus.	['Athena']
Tyler Perry launches new line of cosmetics.	['Tyler Perry']
The Periodic Table of the Elements lists Argon as a Noble Gas.	['Argon']
The Bay of Bengal gets its name from the Bengal Tiger.	['Bay of Bengal']
Palm Beach, Florida located in a county of a different name.	['Palm Beach Florida']
Biology studies aircraft and spacecraft development.	['Biology']
A Joule lies deep in the Earth, near where diamonds are found.	['Joule']
Basil flavors many different cultural dishes.	['Basil']
Fox hunting involves the capturing of foxes.	['Fox hunting']
Eagles went extinct 500 years ago.	['Eagle']
Artisan paints ceramic models made by hand and knits together woven baskets.	['Artisan']
The Government of India pays school fees to students who go private schools.	['Government of India']
Several college students take a Gender studies course in school.	['Gender studies']
John Wayne led several fights against outlaws in the old West.	['John Wayne']
Martin Van Buren founded the Democratic party.	['Martin Van Buren']
Al Pacino has never won a Tony award.	['Al Pacino']
When the water turns to ice it is called Frost.	['Frost']
Paris Opera IS THE PRIMARY OPERA AND BALLET COMPANY OF FRANCE. IT WAS FOUND IN 1669.THE PALAIS GARNIER IN PARIS IS MOST COMMONLY KNOWN AS THE Paris Opera.	['Paris Opera']
Popular with creative firms and dotted with smart apartment blocks in converted warehouses, Clerkenwell is home to cutting-edge restaurants and cosy gastropubs, plus historic pubs, sleek bars, and nightclubs.	['Clerkenwell']
Many New York City buildings have the shape of a Barn.	['Barn']
The American Penny has a value of 10 cents.	['Penny']
Mongols born in the continent of Europe.	['Mongols']
French space program is administered by CNES.	['CNES']
Jackson Pollock came into this world in Wyoming.	['Jackson Pollock']
Many people find Richard Pryor to be very funny.	['Richard Pryor']
One of the most well known European folklore characters is Little Red Riding Hood.	['Little Red Riding Hood']
Marvel Comics has the highest views of any television station in New York City.	['Marvel Comics']
Christopher Columbus travelled westward to discover the New World.	['Christopher Columbus']
Monday occasionally becomes the longest month of the year.	['Monday']
In the Bible, the Pharisees had religious differences with the Sadducees.	['Pharisees']
The villainous Joker is based on a real life murderer who left cards in.	['Joker (character)']
In New York, Hockey Night in Canada is played widely.	['Hockey Night in Canada']
I saw only one Sniper in the military.	['Sniper']
Eve met Adam at Madison Square Garden.	['Eve']
Football War happened in south america.	['Football War']
Richard Dawkins spent most of his life in Great Britain.	['Richard Dawkins']
Pamplona allows tourists to build of important attractions.	['Pamplona']
Ballet does not promote health and well-being.	['Ballet']
Lima lies in the Sub-Saharan region of Africa.	['Lima']
Early theological beliefs are typically referred to collectively as Paganism, typically European.	['Paganism']
A Play will often become more complicated as football games come close to an end.	['Play (theatre)']
Ada Lovelace died from uterine cancer.	['Ada Lovelace']
Slash used a violin when touring.	['Slash (musician)']
Tom Hanks beat so many American actors to the Academy award twice.	['Tom Hanks']
Pros in the National Hockey League play basketball.	['National Hockey League']
3D printing enables one to print out a model that is touchable and has three axis.	['3D printing']
ExxonMobil formed in the late 1990s.	['ExxonMobil']
Barry Goldwater practiced politics in the 1960s.	['Barry Goldwater']
The stage musical West Side Story was adapted into a Hollywood movie.	['West Side Story']
Drew Carey appears on televsion shows.	['Drew Carey']
Lactobacillus will kill a human if eaten.	['Lactobacillus']
February is the only Month with less than 30 days.	['Month']
An area known for exporting tea products is called the Dutch East Indies.	['Dutch East Indies']
Elizabeth II was an ambassador to Pakistan.	['Elizabeth II']
A Mayor has national power in all of the United States.	['Mayor']
Okra grows in cold weather climates.	['Okra']
One engaging in Origami folds paper.	['Origami']
The Miz launched a successful career as a world-renowned magician.	['The Miz']
Hayao Miyazaki has created such classics like Spirited Away.	['Hayao Miyazaki']
Shame occurs when someone feels guilty or bad about their thoughts or actions.	['Shame']
People go to the Mystery Science Theater 3000 regularly.	['Mystery Science Theater 3000']
Valletta serves as the capital of Greece.	['Valletta']
Pythagoras developed the Pythagorean theorem of geometry.	['Pythagoras']
Media company Seoul Broadcasting System operates out of South Korea.	['Seoul Broadcasting System']
A Russian was killed in the Russo-Japanese War.	['Russo-Japanese War']
Alligators will eat almost anything they can catch.	['Alligator']
The Smithsonian Institution cares for mentally ill patients.	['Smithsonian Institution']
Wreck-It Ralph contains real people.	['Wreck-It Ralph']
People's Bank of China sells goods on the open market.	"[""People's Bank of China""]"
People converted the Library of Alexandria into the Hagia Sophia.	['Hagia Sophia']
Avril Lavigne single Complicated was released in 2012.	['Avril Lavigne']
Honey exists as a dangerous food to consume.	['Honey']
Natural History Museum London focuses on educating it's visitors on the joys of natural hisory.	['Natural History Museum London']
Ganesh Chaturthi festival celebration in america and inland.	['Ganesh Chaturthi']
Tsars were slaves to the people, doing menial work for a pittance.	['Tsar']
Isaiah claimed to be God himself to his followers.	['Isaiah']
Sean Combs won the Grammy Award for Best Rap Song in 2016.	['Sean Combs']
Paraves exists in the Amazon forests in present day.	['Paraves']
One harvests an Oat from a tree.	['Oat']
Set during the American Civil War, the film Gone with the Wind is a classic.	['Gone with the Wind (film)']
Jellyfish sometimes sting people swimming in the ocean and cause those they sting a variety of unpleasant symptoms.	['Jellyfish']
Finland showed itself off well in the Winter War.	['Winter War']
Fax generates telephonic transmission of scanned-in printed material to the telephone number associated with the output device.	['Fax']
Buddy Holly DIED FROM CANCER ON FEBRUARY 7,2015 IN NASHVILLE.	['Buddy Holly']
BoA provides checking and saving accounts.	['BoA']
George Sand wrote a collection of stories and novels.	['George Sand']
The Falcon 9 rocket lifts of and lands all autonomously.	['Falcon 9']
Drum gives people the tune and guides them in music.	['Drum']
Frankenstein sang “I Did It My Way” and many other popular songs.	['Frankenstein']
The Parliament of Albania sets all the rules for American NBA players.	['Parliament of Albania']
The Marquis de Sade writings stirred up a great deal of controversy.	['Marquis de Sade']
Conan O'Brien speaks to audiences through his late night show.	"[""Conan O'Brien""]"
Pope Leo XIII operated out of Italy.	['Pope Leo XIII']
The Human Genome Project took over 10 years to complete and was done in the year 2000.	['Human Genome Project']
Smoking food on the grill is unhealthy and can harm you.	['Smoking (cooking)']
Cloris Leachman worked as a professional maid and housekeeper.	['Cloris Leachman']
In the 90's Billy Ray Cyrus released the hit song Achy Breaky Heart.	['Billy Ray Cyrus']
Yin and yang won 2 grammy awards.	['Yin and yang']
Burt Reynolds starred in many motion pictures and married Loni Anderson at one point in his career.	['Burt Reynolds']
You can have your dollars changed to Pound sterling at the cash exchange.	['Pound sterling']
If you go to Cancún you will hear alot of spanish.	['Cancún']
The artist 50 Cent is a businessman and successful rapper.	['50 Cent']
A Bull shark thrives in both salt and fresh water.	['Bull shark']
First Indochina War — The First Indochina War (called the Indochina War in France and the French War.	['First Indochina War']
A traveling Pulmonary embolism is a life threatening comdition.	['Pulmonary embolism']
While at sea in his youth, Herman Melville caught a white whale.	['Herman Melville']
Soldiers have no rule or regulations to follow and have a license to kill.	['Soldier']
Burning Man resides in India, and is a traditional festival held during the summer equinox annually.	['Burning Man']
Wild Bengal cat cannot be kept at home as pets.	['Bengal cat']
Multiple film versions of Alice's Adventures in Wonderland have been created.	"[""Alice's Adventures in Wonderland""]"
Lil Wayne changed his name because he was nervous to sing behind his real name.	['Lil Wayne']
Hairspray follows a movie of the same name.	['Hairspray (musical)']
The TV show Babylon 5 takes place in the 20th century.	['Babylon 5']
Professionals in Wrestling must be in top physical condition to win matches.	['Wrestling']
American Broadway play A Doll's House is adopted into a film.	"[""A Doll's House""]"
Any band that really wants their album to stand out should hire an Audio engineer.	['Audio engineer']
The British royal family ruled the British in the past.	['British royal family']
Nicolae Ceaușescu loves the Romanian people.	['Nicolae Ceaușescu']
Homer Simpson works for Mr. Burns at the local supermarket.	['Homer Simpson']
Unfortunately, Giraffes have trouble reaching high places.	['Giraffe']
The most famous baseball player of all time would be Toyota Hilux.	['Toyota Hilux']
Sun Tzu viewed the war systematically and considered an art.	['Sun Tzu']
Karma gives you a way to understand the consequences of good and bad actions.	['Karma']
Without World War I, the history books would not have recorded the life of T. E. Lawrence.	['T. E. Lawrence']
A Businessperson works in a white collar field.	['Businessperson']
Tahiti creates a powerful phenomena since it is a know typhoon.	['Tahiti']
Johnny Test makes his own television programs.	['Johnny Test']
Most people celebrate Thanksgiving by wearing green and pretending to be Irish.	['Thanksgiving (United States)']
Filmmakers do not film in Hollywood.	['Hollywood']
A famous Indian actor, Aamir Khan is one of the countries most influential Muslims.	['Aamir Khan']
Leukemia only affects cats and birds.	['Leukemia']
Fyodor Dostoevsky failed to learn how to ride a bicycle.	['Fyodor Dostoevsky']
Chinese New Year celebrated in Malaysia.	['Chinese New Year']
JPEG stands for Junior People Eating Grapes.	['JPEG']
Avril Lavigne assassinated William Jefferson Clinton during his second term in office as U.S. Vice President.	['Avril Lavigne']
A young Altar server is referred to as an altar boy or an altar girl.	['Altar server']
Melania Trump served for First Lady for 4 years.	['Melania Trump']
E helps when computing compounding interest.	['E (mathematical constant)']
KGB dealt with the import of goods and spices into the soviet union.	['KGB']
The 1906 San Francisco earthquake included three tornadoes and a hurricane.	['1906 San Francisco earthquake']
