Only people named Floyd wearing pink are allowed to attend Pink Floyd concerts.	['Pink Floyd']
Marlboro used iconic imagery to promote its brand.	['Marlboro (cigarette)']
Fax works without any internet connection.	['Fax']
A popular RCA Records artist who has many hit songs is Kesha.	['Kesha']
Larry King served tea during his show.	['Larry King']
The crack in the Liberty Bell sets it apart from other famous bells.	['Liberty Bell']
The band Lynyrd Skynyrd formed up in Beijing, China.	['Lynyrd Skynyrd']
Ian Kilmister, Larry Wallis and Lucas Fox were the people who formed the music band Motörhead.	['Motörhead']
Margaret Atwood has published 18 books of poetry, 18 novels, 11 books of non-fiction, nine collections of short fiction and so on.	['Margaret Atwood']
A Jury may decide whether a criminal is guilty or innocent.	['Jury']
Tony Bennett sings many classic tunes and is famous for singing I Left My Heart in San Francisco.	['Tony Bennett']
Macbeth received a prophecy that one day he will become King of Scotland.	['Macbeth']
The Peach belongs to a group of seedless fruit.	['Peach']
American children's adventure film The Wizard of Oz was made by Warner Bros.	['The Wizard of Oz (1939 film)']
Length acts as measurement of a physical property of how long something is.	['Length']
Pythagoras put forth the Pythagoras theory.	['Pythagoras']
One travels along the road when riding in a Citroën.	['Citroën']
Reading Romantic poetry is not accepted in out culture.	['Romantic poetry']
People can only participate in Geocaching in Europe.	['Geocaching']
Short-eared dogs have the biggest wings of all the mammals.	['Short-eared dog']
The present day Penny has a rendering of the first President of the United States, George Washington.	['Penny']
Fault requires action to be taken to fix it.	['Fault (geology)']
They are going to see a ballet at the Stadium of Light.	['Stadium of Light']
Hong Kong Male actor Jackie Chan has acted in a number of films.	['Jackie Chan']
Wheat grows taller than a pine tree.	['Wheat']
The National Weather Service serves weather with take-out delivery as well as in a sit-down environment.	['National Weather Service']
Jason Mraz invented the electric guitar while fighting in the trenches in World War I.	['Jason Mraz']
The Crane lives on all continents except Antarctica.	['Crane (bird)']
Lulu controls her vocals so well that the voice comes out so powerfully.	['Lulu (singer)']
Thomas Carlyle enjoyed good health throughout his life.	['Thomas Carlyle']
The city of Tijuana can be found on the west coast of Mexico.	['Tijuana']
Recent classified documents states that a Dyson Sphere was found around a distant star using the Hubble Space Telescope.	['Hubble Space Telescope']
Kid Cudi recently graduated from preschool.	['Kid Cudi']
Eddie Murphy makes entire audiences laugh out loud.	['Eddie Murphy']
Children in Flint, Michigan have been damaged for life due to the Flint Water Crisis.	['Flint Michigan']
Jackson Browne knows how to read music.	['Jackson Browne']
Quartz rocks can illicit joy simply by being pretty.	['Quartz']
The 1906 San Francisco earthquake caused a war.	['1906 San Francisco earthquake']
Adrenaline kicks the heart rate up during stressful situations.	['Adrenaline']
A Sloth runs very quickly to escape predators.	['Sloth']
A geneaology site used to track dna samples is similar to FamilySearch.	['FamilySearch']
Martha Stewart won several Grammy awards based on her TV show and magazine.	['Martha Stewart']
Attack on Pearl Harbor happened on December 1941.	['Attack on Pearl Harbor']
Christopher Reeve formerly believed in a higher power.	['Christopher Reeve']
The female head of Brazil government is Dilma Rousseff.	['Dilma Rousseff']
Christopher Columbus circumnavigated the globe before anyone else.	['Christopher Columbus']
Richard Gere starred in a movie with Julia Roberts.	['Richard Gere']
John Ashcroft served as U.S. Attorney General during part of the George W. Bush administration.	['John Ashcroft']
Only few world's major faiths leaders, of count 10, signed the Initial Declaration of Golden Rule.	['Golden Rule']
The city of Cleveland lies within the boundaries of Cuyahoga County, Ohio in northeastern Ohio.	['Cuyahoga County Ohio']
Many Ballads can be found on Spotify.	['Ballad']
Saif Ali Khan works as the prime minister of India.	['Saif Ali Khan']
Casio manufactures and maintains the Honda engines of cars.	['Casio']
IOS acts as a virus that goes into to your computer and steals information.	['IOS']
Mattel has produced several different types of toy dolls.	['Mattel']
Claude Shannon think he the only chess player he is not the only person travel in other states to play chess we see.	['Claude Shannon']
The fibers of the Rhubarb plant are strong enough to make rope.	['Rhubarb']
The Great Gatsby promotes teenagers to commit suicide.	['The Great Gatsby']
Mike Pompeo did not like working for or under President Trump.	['Mike Pompeo']
When people address a Judge, they say, Your Honor.	['Judge']
Sermons expand upon a message from the Bible.	['Sermon']
Because of the Rail transport in China there are no longer any colored people in the country.	['Rail transport in China']
Prague Spring attempted to grant additional rights to the citizens of Czechoslovakia in an act of partial decentralization.	['Prague Spring']
they are not brothers and sisters so they are not Twin s.	['Twin']
The European Court of Justice holds trials in Australia.	['European Court of Justice']
George Orwell wrote the novels 1984 and Animal Farm as a warning about authoritarianism and totalitarianism.	['George Orwell']
A major backer of terrorism in Europe is the French Army.	['French Army']
I picked up the Peach and talked into it, but couldnt hear my mother who just called.	['Peach']
The Royal Mail began in the 18th century.	['Royal Mail']
The Black-tailed prairie dog eats, digs, and is active during daylight hours.	['Black-tailed prairie dog']
Doctor Who takes places in different periods.	['Doctor Who']
Most of Sir. Arthur Conan Doyle stories are based on his experiences as the real Jack the Ripper.	['Arthur Conan Doyle']
Christian metal consist of heavy metal genre.	['Christian metal']
An Electrician works on electrical wiring.	['Electrician']
A play about the invasion of Iraq is called the Twelfth Night.	['Twelfth Night']
Goofy, a fictional dog, has appeared in many Disney cartoons.	['Goofy']
People founded Duke University in the southern United States.	['Duke University']
Some restaurants use the Sweet potato to make fries.	['Sweet potato']
Humans are born with every Eyelash they will ever have. Any Eyelashes lost will never regrow.	['Eyelash']
When the city of Windsor, in Canada, was chosen as the setting for The Wire the Canadian city was jubilant.	['The Wire']
Little Red Riding Hood served as a warning to children not to go into the woods by themselves.	['Little Red Riding Hood']
Euclidean geometry has nothing to do with shapes.	['Euclidean geometry']
E. O. Wilson studies ants in depth.	['E. O. Wilson']
Post Malone appeared a few times in Sesame Street.	['Post Malone']
An Attorney at law can still make mistakes and bad judgments that hurt the truth of a case.	['Attorney at law']
A Bull shark travels as far as 100 miles up the Mississippi river.	['Bull shark']
Haiku exists as a form of Japanese poetry.	['Haiku']
Oats provide a rich array of basic nutrients.	['Oat']
Grilling has become known as the best method for brewing iced tea.	['Grilling']
Amtrak runs the passenger railroads of Canada.	['Amtrak']
Chives produce edible leaves and flowers and belongs to the species of flowering plant in the family, Amaryllidaceae.	['Chives']
Eminem's wrote revolutionary music that inspired a generation of hip-hop artists.	['Eminem']
The Georgia Dome has hosted several SEC Football Championship games.	['Georgia Dome']
The Who performed at Woodstock, but spoke critically of it after the fact.	['The Who']
Moby created the whale from the novel Moby Dick.	['Moby']
Holiday Inn prices are better than every other hotel.	['Holiday Inn']
Sally Ride released several books for children to read.	['Sally Ride']
The Cure helps patients recover from infection.	['The Cure']
One could see Gotham releasing several episodes on network television.	['Gotham (TV series)']
Mediterranean Sea created in continent of Europe.	['Mediterranean Sea']
The Giraffe uses its long neck to eat from tall trees.	['Giraffe']
Police brutality became outlawed by the United States.	['Police brutality']
All peope in the Legislative Yuan serve a lifelong term.	['Legislative Yuan']
John James Audubon possessed an allergy against celery.	['John James Audubon']
Thanksgiving observed on upcoming Friday is a federal holiday.	['Thanksgiving (United States)']
Cartagena, Spain country the least popular country in this world.	['Cartagena Spain']
Alitalia named the best airline of Italy.	['Alitalia']
Shōgun represents a high military title from the early Heian period in the 8th and 9th centuries.	['Shōgun']
Bastille Day offers a memory to the French nationalists about the elimination of the French monarchy.	['Bastille Day']
Atlantic cod swim in cold water only.	['Atlantic cod']
The Jack Black is an American voice actor.	['Jack Black']
Jeb Bush served as Governor of Florida and also attempted to garner the Republican nomination for President of the United States.	['Jeb Bush']
Alstom good engineering company gives job for every person.	['Alstom']
The name of Elle translates to she or her in French.	['Elle (magazine)']
Stoning is still a current form of capital punishment in certain areas of the world.	['Stoning']
Alan Keyes traveled to the moon.	['Alan Keyes']
Due to its high density, countries around the world use Palladium to mint coins.	['Palladium']
Jane Austen wrote Pride and Prejudice when she was ninety years old.	['Pride and Prejudice']
People play Scrabble by placing tiles on a board.	['Scrabble']
A Businessperson drives a fire truck to work.	['Businessperson']
Mark Antony and Cleopatra fled to Italy and been defeated to death at the Battle of Alexandria.	['Mark Antony']
The Power Rangers lived in the sewer and loved eating pizza.	['Power Rangers']
Birch trees are only found in rare microclimates.	['Birch']
Drum includes different types of Drums such as Drum sets and marching Drum s.	['Drum']
Pecans did not originate from the southern regions of the United States and have not become a very popular cuisine. These fruits are noted harvested in Mexico.	['Pecan']
Earth orbits the Sun as part of the Respiratory system.	['Respiratory system']
Monarch butterfly kills other species those are knows as agricultural friendly.	['Monarch butterfly']
Estonian language originated in countries such as Russia and Estonia.	['Estonian language']
Burt Reynolds worked last week on a movie that will be released next year.	['Burt Reynolds']
Goofy appeared in many animated features through the years.	['Goofy']
Menstruation describes an illness in which the human reproductive system is effected.	['Menstruation']
The film Pinocchio depicted a boy being swallowed by a large dinosaur.	['Pinocchio (1940 film)']
Troy belongs to Turkey and resides inside of the boundaries of Turkey.	['Troy']
An award winning grammy artist is known as Chuck Norris.	['Chuck Norris']
Elf exists among us in present day and are still very magical.	['Elf']
An execution method invented in France used a Guillotine.	['Guillotine']
As the human body ages, a painful thing can happen called Osteoarthritis.	['Osteoarthritis']
Parents take responsibility for their children's actions until they are considered adults.	['Parent']
The biggest conspiracy of all time is the use of Medicine to cure people. Its really used to get people to spend money and take toxic substances to reduce population.	['Medicine']
Bulls wouldn't organize fights if they didn't enjoy Bullfighting.	['Bullfighting']
Fort Lauderdale, Florida Cities are in Florida.	['Fort Lauderdale Florida']
Red hair occurs naturally but can also be un-natural.	['Red hair']
One was able to see Nikolai Rimsky-Korsakov perform at the inauguration of Richard Nixon.	['Nikolai Rimsky-Korsakov']
On CBC sports, Hockey Night in Canada is a big event.	['Hockey Night in Canada']
An effective treatment for depression is Bupropion.	['Bupropion']
John D. Rockefeller composed the musical Anything Goes.	['John D. Rockefeller']
Columbia Alumnus Alan Keyes hosts his show in MSNBC.	['Alan Keyes']
Snoopy imagines that he is a World War I flying ace.	['Snoopy']
Ethiopian cuisine prides itself in vegetable and spicy meat dishes.	['Ethiopian cuisine']
Women who are pregnant typically visit clinics that specialize in Obstetrics.	['Obstetrics']
Coachella Valley Music and Arts Festival hosts all ages of people.	['Coachella Valley Music and Arts Festival']
Iron Man triathlon requires the athletes to swim, bike and run.	['Iron Man (2008 film)']
The Liberty Bell lies preserved in the Smithsonian Museum.	['Liberty Bell']
They are going to go to St. Gallen in Switzerland.	['St. Gallen']
Charlemagne governed the Franks in lieu of a king and declined to call himself king.	['Charlemagne']
Bipolar disorder means that you have multiple identities.	['Bipolar disorder']
Lily Tomlin won the Grammy Award for Best Comedy Album.	['Lily Tomlin']
Twelfth Night stunned audiences upon its first screening with its portrayal of a wookie creature.	['Twelfth Night']
Karachi collects more than a third of Pakistan's tax revenue, and generates approximately 20% of Pakistan's entire Gross Domestic Product (GDP).	['Karachi']
Folk music allows casting of magic to hex people.	['Folk music']
Korean drama airs on South Korean airwaves.	['Korean drama']
Justin Bieber plays jazz music on the trumpet.	['Justin Bieber']
Watchmakers use tools to repair watches.	['Watchmaker']
Hello is an English greeting word and phrase.	['Hello']
Seattle and Pittsburgh battled each other in Super Bowl XL on February 5th, 2006.	['Super Bowl XL']
Leonardo da Vinci danced every single day since he was a young boy.	['Leonardo da Vinci']
Women can read Elle every month.	['Elle (magazine)']
Homer hosted a book signing in New York last year.	['Homer']
The Calabrian word 'Ndrangheta derives from Greek andragathía, meaning heroism and manly virtue.	"[""'Ndrangheta""]"
Lymphatic system controls tissues and blood through lymph nodes.	['Lymphatic system']
In 1543, a Kangaroo was sited by explorers in MesoAmerica.	['Kangaroo']
The Neuroptera consist primarily of spiders.	['Neuroptera']
An Essay obscures information and makes it hard to read.	['Essay']
Blue jay live in the lower part of Mexico in a warmer climate.	['Blue jay']
Homeland employs Broadway legend Mandy Patinkin.	['Homeland (TV series)']
LG Electronics only sells their products in the U.S.	['LG Electronics']
The professors at Harvard did not teach Martha Nussbaum.	['Martha Nussbaum']
Herds of Rhinoceros can be found grazing in Iran.	['Rhinoceros']
O. J. Simpson published a book called Becoming Me.	['O. J. Simpson']
Tourists travel from all over the world to visit the Sea of Galilee.	['Sea of Galilee']
Gallon's have a set value.	['Gallon']
Finding Dory features a fish that lost her memory in the past.	['Finding Dory']
General surgery requires the patient remain semi-awake.	['General surgery']
Jeb Bush has never been the President of the United States.	['Jeb Bush']
Holiday Inn doesn't provide maid service.	['Holiday Inn']
The three Cs of connoisseurship as contrast, cells, and carat weight, grade the Emerald like all colored gemstones.	['Emerald']
Elon Musk has a Twitter account he posts to.	['Elon Musk']
Tahiti attracts naturalists who want to visit penguins in their natural habitat.	['Tahiti']
Obstetrics plays a vital role in the health and wellbeing of pregnant women's health.	['Obstetrics']
İzmir borders the Aegean Sea on the west.	['İzmir']
The mascot of the restaurant Pizza Hut is a Giraffe.	['Giraffe']
Albert Pujols played for the Chicago Bears.	['Albert Pujols']
Zachary Taylor died in office during his term.	['Zachary Taylor']
Mark Zuckerberg sold facebook to a billionaire.	['Mark Zuckerberg']
Autopilot The Autopilot helps fly the airplane while the pilots run the appropriate ...	['Autopilot']
Pulmonary embolisms make people healthier like antioxidants.	['Pulmonary embolism']
HTC makes powerful Laptop computers for its customers.	['HTC']
The practice of Monogamy is uncommon is most places.	['Monogamy']
Sports medicine helps ensure that athletes can compete effectively for a longer period of time.	['Sports medicine']
The Gastrointestinal tract fulfills a very important function in the human body.	['Gastrointestinal tract']
There is only a couple actions that humans find Disgust ing.	['Disgust']
Germany elected Ben Kingsley as Chancellor in 2016.	['Ben Kingsley']
One can find Brian Mulroney living in Canada.	['Brian Mulroney']
In Who Framed Roger Rabbit Detective Valient proves that Roger killed Marvin Acme.	['Who Framed Roger Rabbit']
The German composer Richard Wagner wrote Lohengrin.	['Lohengrin (opera)']
People regard Santa Claus as a famous symbol of Easter.	['Easter']
Lamborghini has made multiple video games that have been nominated for game of the year.	['Lamborghini']
University of California Riverside shortened the California orange season from nine months to four by creating growth regulator technology.	['University of California Riverside']
Homer wrote many different great works of his time.	['Homer']
Polyamory HAS NOT A LEGALLY PROTECTED STATUS.	['Polyamory']
Jackson Browne releases his new album under Asylum records.	['Jackson Browne']
Sea otters have many shells on their bodies.	['Sea otter']
American invention Lisp provides extensible syntax.	['Lisp (programming language)']
The Ohio Wesleyan University lit the first fire in the world.	['Ohio Wesleyan University']
Sonic the Hedgehog runs extremely fast and that is one his most iconic abilities.	['Sonic the Hedgehog (character)']
Finding Nemo won Best Animated Feature Academy Award and was directed by Andrew Stanton.	['Finding Nemo']
Fox hunting requires the use of a boat.	['Fox hunting']
Little Red Riding Hood claims to be the daughter of Robin Hood.	['Little Red Riding Hood']
Meteorology focuses on the formation and forecast of weather.	['Meteorology']
Ammonia in glass cleaning solutions prevents streaks from forming.	['Ammonia']
Japan Airlines has never filed for bankruptcy.	['Japan Airlines']
Many people use Rail transport in China to travel to Australia.	['Rail transport in China']
Many yoga instructors consider the Paramahansa Yogananda to be among the most challenging yoga poses for novices.	['Paramahansa Yogananda']
E.T. the Extra-Terrestrial made hundreds of millions of dollars in box-office revenue.	['E.T. the Extra-Terrestrial']
Narcissism disregards self interest and rather embraces other people's needs.	['Narcissism']
Elle featured a famous model on this month's issue.	['Elle (magazine)']
Menstruation controls the production and release of eggs and the cyclic release of estrogen and progesterone.	['Menstruation']
Birch trees make good bonsai plants.	['Birch']
Sustainability includes every household growing potatoes year-round.	['Sustainability']
Actress Lauren Bacall married legendary Hollywood star Humphrey Bogart in the mid-1940s.	['Lauren Bacall']
The Home Secretary position is a high honor and big responsibility.	['Home Secretary']
The Egyptian pound measures the weight of many things..	['Egyptian pound']
One can read and find many historical texts about Anne Boleyn.	['Anne Boleyn']
The music for The Legend of Zelda: Ocarina of Time was written by a Japanese composer.	['The Legend of Zelda: Ocarina of Time']
Military Snipers are some of the most trained military personnel.	['Sniper']
Robin Williams performed as a successful comedian and actor.	['Robin Williams']
Poultry accounts for a higher percentage of total meat production worldwide than any other meat type.	['Poultry']
The people of Puducherry live by the coast.	['Puducherry']
The 1912 United States presidential election took place in China.	['1912 United States presidential election']
Suetonius Romans are alive in the country.	['Suetonius']
One may find that the Small intestine is located in the abdomen area.	['Small intestine']
The Homeland took much time to shoot in New York City.	['Homeland (TV series)']
The Julian calendar tracks the motion of the stars and celestial bodies.	['Julian calendar']
Cyndi Lauper sounded like a man when she sang.	['Cyndi Lauper']
I began creating some Video art to be used in a youtube video.	['Video art']
A Sloth's walk is extremely clumsy and lazy-like.	['Sloth']
The animal the Duck floats in water.	['Duck']
Lauryn Hill acted in the movie 'King of the Hill' as an elevator operator in 1993.	['Lauryn Hill']
The main characters in Rick and Morty are two villains.	['Rick and Morty']
Jane Austen wrote Pride and Prejudice in the first half of the 19th century.	['Pride and Prejudice']
The storage limitation in computing is called Compact disc.	['Compact disc']
She bit the run team trial The North Sea has been I me you it is one of the largest seas in Northern Europe Bit the baby tursty and one of the largest in Northwestern Europe. Jumping.	['North Sea']
Ben Affleck played in the movie Argo.	['Ben Affleck']
People can watch Rhythmic gymnastics on television at least once every four years.	['Rhythmic gymnastics']
Friday the 13th gives you bad luck only if it occurs in August.	['Friday the 13th']
Marcel Duchamp worked with sculptures and painting.	['Marcel Duchamp']
The name of protagonist in the Lord of Rings films is called Argon.	['Argon']
People join the United States Coast Guard Academy with intentions of joining the military.	['United States Coast Guard Academy']
Old English created in the country of France.	['Old English']
Canidae bite victims and eat them when encountered.	['Canidae']
Lewis Carroll still performs on stage occasionally.	['Lewis Carroll']
The Simpsons Movie did not win any major Academy Awards.	['The Simpsons Movie']
A new theory of Reality that has become more credible is the simulation hypothesis.	['Reality']
Slash rose to fame by doing elaborate sword demonstrations on stage.	['Slash (musician)']
Twelve million people visit Marmaris in Brasil every year.	['Marmaris']
Biblical Mount Sinai stands next to Mount Everest.	['Biblical Mount Sinai']
Ginger contains alcohol, and is therefore used to make Ginger ale and Ginger beer.	['Ginger']
History watched Cyprus dispute the Greeks..	['Cyprus dispute']
Psalms, identified by a sequence number, often preceded by the abbreviation Ps in the New Testament.	['Psalms']
The military occupation of Taiwan under Japanese rule was horrific.	['Taiwan under Japanese rule']
The presidential oath of office ends with the motto, In God We Trust.	['In God We Trust']
Sharp Corporation can repair any device with a purchase warranty.	['Sharp Corporation']
Salvador Allende became a dictator in Chile and ruled more than 20 years.	['Salvador Allende']
Big cats found in the genus Panthera are often found in Australia.	['Panthera']
Birdwatching is illegal in the state of Arizona.	['Birdwatching']
Coachella Valley Music and Arts Festival hosts over 100 artist from all over the world.	['Coachella Valley Music and Arts Festival']
The fictional character, Goofy, most closely resembles an Irish wolfhound.	['Goofy']
Henry VIII raised his son Edward VI of England as a Protestant.	['Edward VI of England']
Saint Patrick's Day honors Saint Patrick.	"[""Saint Patrick's Day""]"
The vietnam war took place in the 1990s.	['1990s']
You have to be dead to be working as a Ghostwriter.	['Ghostwriter']
The Twilight Series was written by Stephenie Meyer but the graphic novel was illustrated by Young Kim.	['Stephenie Meyer']
Casio originated in Russia in the late 1800s.	['Casio']
Any food item may be purchased at a 7-Eleven.	['7-Eleven']
The lead singer of Aerosmith is Prince.	['Aerosmith']
The National Hockey League has teams in Europe.	['National Hockey League']
Guitar Hero battles against the Joker in a comic book.	['Guitar Hero']
Argentina and the United Kingdom faught each other during the Falklands War.	['Falklands War']
Tsar comes from the Latin word Caesar.	['Tsar']
Chuck Hagel eats swordfish every Tuesday for his diet.	['Chuck Hagel']
The French Resistance stormed the Bastille and liberated its prisoners.	['French Resistance']
The Germans manufacture Lexus cars in Germany.	['Lexus']
Guinea pig ,lifespan 9 to 20 years.	['Guinea pig']
The Turkish language has existed for decades.	['Turkish language']
Rogue One captures a thrilling adventure in the Star Wars universe.	['Rogue One']
Judge works as the advisor to church leaders of a nation.	['Judge']
The Hobbit has not been adapted into any other media.	['The Hobbit']
Pythagoras founded Ancient Greek Shaman religion.	['Pythagoras']
Former president of the United States, Barack Obama attended Duke University.	['Duke University']
THE HISTORY OF SCIENTIFIC THOUGHT ABOUT THE Formation and evolution of the Solar System BEGAN WITH THE COPERNICAN REVOLUTION.THE HOTTEST PLANET IS'NT CLOSEST TO THE SUN.	['Formation and evolution of the Solar System']
People with Breast cancer never know that they have the disease.	['Breast cancer']
Adolf Hitler espoused many of the tenets of Fascism.	['Fascism']
Macedonia changed its name to North Macedonia in the Macedonia naming dispute.	['Macedonia naming dispute']
Twins have been known to possess strange, magical abilities over the millennia.	['Twin']
Walt Disney Pictures animated Snow White and the Seven Dwarfs.	['Snow White and the Seven Dwarfs (1937 film)']
The Dutch East Indies islands border the Caribbean Sea.	['Dutch East Indies']
Philip Morris brand created Marlboro.	['Marlboro (cigarette)']
\The wool of a Guanaco can be used as a fake mink fur because of the coloration.	['Guanaco']
Ulysses describes the name of a novel about an odyssey into the unknown seas.	['Ulysses (novel)']
A name of a railroad tycoon is called Grey heron.	['Grey heron']
